[
  {
    "date": "19-02-2026",
    "sehri": "19-02-2026T04:46:00",
    "iftaar": "19-02-2026T18:50:00",
    "dateHijri": "01"
  },
  {
    "date": "20-02-2026",
    "sehri": "20-02-2026T04:47:00",
    "iftaar": "20-02-2026T18:49:00",
    "dateHijri": "02"
  },
  {
    "date": "21-02-2026",
    "sehri": "2026-02-21T04:47:00",
    "iftaar": "2026-02-21T18:48:00",
    "dateHijri": "03"
  },
  {
    "date": "22-02-2026",
    "sehri": "2026-02-22T04:48:00",
    "iftaar": "2026-02-22T18:48:00",
    "dateHijri": "04"
  },
  {
    "date": "23-02-2026",
    "sehri": "2026-02-23T04:48:00",
    "iftaar": "2026-02-23T18:47:00",
    "dateHijri": "05"
  },
  {
    "date": "24-02-2026",
    "sehri": "2026-02-24T04:49:00",
    "iftaar": "2026-02-24T18:46:00",
    "dateHijri": "06"
  },
  {
    "date": "25-02-2026",
    "sehri": "2026-02-25T04:49:00",
    "iftaar": "2026-02-25T18:46:00",
    "dateHijri": "07"
  },
  {
    "date": "26-02-2026",
    "sehri": "2026-02-26T04:50:00",
    "iftaar": "2026-02-26T18:45:00",
    "dateHijri": "08"
  },
  {
    "date": "27-02-2026",
    "sehri": "2026-02-27T04:50:00",
    "iftaar": "2026-02-27T18:44:00",
    "dateHijri": "09"
  },
  {
    "date": "28-02-2026",
    "sehri": "2026-02-28T04:51:00",
    "iftaar": "2026-02-28T18:43:00",
    "dateHijri": "10"
  },
  {
    "date": "01-03-2026",
    "sehri": "2026-03-01T04:52:00",
    "iftaar": "2026-03-01T18:42:00",
    "dateHijri": "11"
  },
  {
    "date": "02-03-2026",
    "sehri": "2026-03-02T04:52:00",
    "iftaar": "2026-03-02T18:42:00",
    "dateHijri": "12"
  },
  {
    "date": "03-03-2026",
    "sehri": "2026-03-03T04:53:00",
    "iftaar": "2026-03-03T18:41:00",
    "dateHijri": "13"
  },
  {
    "date": "04-03-2026",
    "sehri": "2026-03-04T04:53:00",
    "iftaar": "2026-03-04T18:40:00",
    "dateHijri": "14"
  },
  {
    "date": "05-03-2026",
    "sehri": "2026-03-05T04:54:00",
    "iftaar": "2026-03-05T18:39:00",
    "dateHijri": "15"
  },
  {
    "date": "06-03-2026",
    "sehri": "2026-03-06T04:54:00",
    "iftaar": "2026-03-06T18:38:00",
    "dateHijri": "16"
  },
  {
    "date": "07-03-2026",
    "sehri": "2026-03-07T04:54:00",
    "iftaar": "2026-03-07T18:38:00",
    "dateHijri": "17"
  },
  {
    "date": "08-03-2026",
    "sehri": "2026-03-08T04:55:00",
    "iftaar": "2026-03-08T18:37:00",
    "dateHijri": "18"
  },
  {
    "date": "09-03-2026",
    "sehri": "2026-03-09T04:55:00",
    "iftaar": "2026-03-09T18:36:00",
    "dateHijri": "19"
  },
  {
    "date": "10-03-2026",
    "sehri": "2026-03-10T04:55:00",
    "iftaar": "2026-03-10T18:35:00",
    "dateHijri": "20"
  },
  {
    "date": "11-03-2026",
    "sehri": "2026-03-11T04:56:00",
    "iftaar": "2026-03-11T18:34:00",
    "dateHijri": "21"
  },
  {
    "date": "12-03-2026",
    "sehri": "2026-03-12T04:56:00",
    "iftaar": "2026-03-12T18:33:00",
    "dateHijri": "22"
  },
  {
    "date": "13-03-2026",
    "sehri": "2026-03-13T04:57:00",
    "iftaar": "2026-03-13T18:33:00",
    "dateHijri": "23"
  },
  {
    "date": "14-03-2026",
    "sehri": "2026-03-14T04:57:00",
    "iftaar": "2026-03-14T18:32:00",
    "dateHijri": "24"
  },
  {
    "date": "15-03-2026",
    "sehri": "2026-03-15T04:58:00",
    "iftaar": "2026-03-15T18:31:00",
    "dateHijri": "25"
  },
  {
    "date": "16-03-2026",
    "sehri": "2026-03-16T04:58:00",
    "iftaar": "2026-03-16T18:30:00",
    "dateHijri": "26"
  },
  {
    "date": "17-03-2026",
    "sehri": "2026-03-17T04:58:00",
    "iftaar": "2026-03-17T18:29:00",
    "dateHijri": "27"
  },
  {
    "date": "18-03-2026",
    "sehri": "2026-03-18T04:59:00",
    "iftaar": "2026-03-18T18:28:00",
    "dateHijri": "28"
  },
  {
    "date": "19-03-2026",
    "sehri": "2026-03-19T04:59:00",
    "iftaar": "2026-03-19T18:27:00",
    "dateHijri": "29"
  },
  {
    "date": "20-03-2026",
    "sehri": "2026-03-20T04:59:00",
    "iftaar": "2026-03-20T18:27:00",
    "dateHijri": "30"
  }
]
